Sheet: Table1
A2: 0433 793 880 | B2: 고구마앙금빵 | C2: 1 | D2: 2 | E2: 2 | G2: 0433 893 031 | H2: 고구마앙금빵 | I2: 2 | J2: 2 | K2: 4
A3: 0433 793 880 | B3: 꽈베기 | C3: 2 | D3: 1 | E3: 2 | G3: 0433 893 031 | H3: 고로케(감자) | I3: 3 | J3: 2 | K3: 6
A4: 0433 793 880 | B4: 소보루 | C4: 2 | D4: 1.5 | E4: 3 | G4: 0433 893 031 | H4: 고로케(당면) | I4: 3 | J4: 2 | K4: 6
A5: 0433 793 880 | B5: 커피번 | C5: 2 | D5: 1.5 | E5: 3 | G5: 0433 893 031 | H5: 꽈베기 | I5: 3 | J5: 1 | K5: 3
A6: 0433 793 880 | B6: 팥빵 | C6: 2 | D6: 1.5 | E6: 3 | G6: 0433 893 031 | H6: 소보루 | I6: 2 | J6: 1.5 | K6: 3
A7: 0433 793 880 | B7: 팥빵(찹쌀) | C7: 1 | D7: 2 | E7: 2 | G7: 0433 893 031 | H7: 소보루(튀김) | I7: 2 | J7: 2 | K7: 4
E8: =SUM(R[-6]C:R[-1]C) -> 15 | G8: 0433 893 031 | H8: 커피번 | I8: 2 | J8: 1.5 | K8: 3
G9: 0433 893 031 | H9: 팥빵(찹쌀) | I9: 3 | J9: 2 | K9: 6
K10: =SUM(R[-8]C:R[-1]C) -> 35
A15: 0439 882 070 | B15: 꽈베기 | C15: 8 | D15: 1 | E15: 8 | G15: 0451 075 088 | H15: 고구마앙금빵 | I15: 1 | J15: 2 | K15: 2
A16: 0439 882 070 | B16: 커피번 | C16: 4 | D16: 1.5 | E16: 6 | G16: 0451 075 088 | H16: 고로케(감자) | I16: 1 | J16: 2 | K16: 2
E17: =SUM(R[-2]C:R[-1]C) -> 14 | G17: 0451 075 088 | H17: 고로케(당면) | I17: 1 | J17: 2 | K17: 2
G18: 0451 075 088 | H18: 꽈베기 | I18: 3 | J18: 1 | K18: 3
G19: 0451 075 088 | H19: 소보루(튀김) | I19: 1 | J19: 2 | K19: 2
G20: 0451 075 088 | H20: 팥빵 | I20: 2 | J20: 1.5 | K20: 3
G21: 0451 075 088 | H21: 팥빵(찹쌀) | I21: 3 | J21: 2 | K21: 6
K22: =SUM(R[-7]C:R[-1]C) -> 20
A26: Giselle | B26: 팥빵 | C26: 20 | D26: 1.5 | E26: 30 | G26: Helen | H26: 고구마앙금빵 | I26: 2 | J26: 2 | K26: 4
A27: Giselle | B27: 팥빵(찹쌀) | C27: 30 | D27: 2 | E27: 60 | G27: Helen | H27: 고로케(당면) | I27: 4 | J27: 2 | K27: 8
E28: =SUM(R[-2]C:R[-1]C) -> 90 | G28: Helen | H28: 꽈베기 | I28: 6 | J28: 1 | K28: 6
G29: Helen | H29: 소보루 | I29: 4 | J29: 1.5 | K29: 6
G30: Helen | H30: 팥빵 | I30: 4 | J30: 1.5 | K30: 6
K31: =SUM(R[-5]C:R[-1]C) -> 30
A37: Kate kim | B37: 고로케(당면) | C37: 2 | D37: 2 | E37: 4 | G37: MJ | H37: 고구마앙금빵 | I37: 1 | J37: 2 | K37: 2
A38: Kate kim | B38: 소보루 | C38: 4 | D38: 1.5 | E38: 6 | G38: MJ | H38: 고로케(감자) | I38: 1 | J38: 2 | K38: 2
A39: Kate kim | B39: 커피번 | C39: 6 | D39: 1.5 | E39: 9 | G39: MJ | H39: 고로케(당면) | I39: 1 | J39: 2 | K39: 2
E40: =SUM(R[-3]C:R[-1]C) -> 19 | G40: MJ | H40: 소보루(튀김) | I40: 2 | J40: 2 | K40: 4
K41: =SUM(R[-4]C:R[-1]C) -> 10
A52: 김문유(0421 564 960) | B52: 고구마앙금빵 | C52: 2 | D52: 2 | E52: 4 | G52: 김은정(0484 342 918) | H52: 고로케(감자) | I52: 3 | J52: 2 | K52: 6
A53: 김문유(0421 564 960) | B53: 고로케(감자) | C53: 2 | D53: 2 | E53: 4 | G53: 김은정(0484 342 918) | H53: 고로케(당면) | I53: 1 | J53: 2 | K53: 2
A54: 김문유(0421 564 960) | B54: 고로케(당면) | C54: 2 | D54: 2 | E54: 4 | G54: 김은정(0484 342 918) | H54: 꽈베기 | I54: 2 | J54: 1 | K54: 2
A55: 김문유(0421 564 960) | B55: 꽈베기 | C55: 2 | D55: 1 | E55: 2 | G55: 김은정(0484 342 918) | H55: 커피번 | I55: 2 | J55: 1.5 | K55: 3
A56: 김문유(0421 564 960) | B56: 소보루 | C56: 2 | D56: 1.5 | E56: 3 | G56: 김은정(0484 342 918) | H56: 팥빵 | I56: 2 | J56: 1.5 | K56: 3
A57: 김문유(0421 564 960) | B57: 커피번 | C57: 2 | D57: 1.5 | E57: 3 | K57: =SUM(R[-5]C:R[-1]C) -> 16
A58: 김문유(0421 564 960) | B58: 팥빵 | C58: 3 | D58: 1.5 | E58: 4.5
E59: =SUM(R[-7]C:R[-1]C) -> 24.5
A70: 멜번그녀:썬 | B70: 꽈베기 | C70: 3 | D70: 1 | E70: 3 | G70: 썸머(0411 174 392) | H70: 고구마앙금빵 | I70: 2 | J70: 2 | K70: 4
A71: 멜번그녀:썬 | B71: 소보루 | C71: 3 | D71: 1.5 | E71: 4.5 | G71: 썸머(0411 174 392) | H71: 고로케(감자) | I71: 2 | J71: 2 | K71: 4
A72: 멜번그녀:썬 | B72: 커피번 | C72: 3 | D72: 1.5 | E72: 4.5 | G72: 썸머(0411 174 392) | H72: 고로케(당면) | I72: 2 | J72: 2 | K72: 4
A73: 멜번그녀:썬 | B73: 팥빵 | C73: 3 | D73: 1.5 | E73: 4.5 | G73: 썸머(0411 174 392) | H73: 꽈베기 | I73: 5 | J73: 1 | K73: 5
A74: 멜번그녀:썬 | B74: 팥빵(찹쌀) | C74: 3 | D74: 2 | E74: 6 | G74: 썸머(0411 174 392) | H74: 소보루 | I74: 5 | J74: 1.5 | K74: 7.5
E75: =SUM(R[-5]C:R[-1]C) -> 22.5 | G75: 썸머(0411 174 392) | H75: 소보루(튀김) | I75: 5 | J75: 2 | K75: 10
G76: 썸머(0411 174 392) | H76: 커피번 | I76: 5 | J76: 1.5 | K76: 7.5
G77: 썸머(0411 174 392) | H77: 팥빵 | I77: 10 | J77: 1.5 | K77: 15
G78: 썸머(0411 174 392) | H78: 팥빵(찹쌀) | I78: 5 | J78: 2 | K78: 10
K79: =SUM(R[-9]C:R[-1]C) -> 67
A84: 에이린(0421 767 742) | B84: 꽈베기 | C84: 16 | D84: 1 | E84: 16
A85: 에이린(0421 767 742) | B85: 소보루 | C85: 1 | D85: 1.5 | E85: 1.5
A86: 에이린(0421 767 742) | B86: 커피번 | C86: 3 | D86: 1.5 | E86: 4.5
A87: 에이린(0421 767 742) | B87: 팥빵 | C87: 2 | D87: 1.5 | E87: 3
E88: =SUM(R[-4]C:R[-1]C) -> 25
A100: 은전동생1:Honey | B100: 고로케(당면) | C100: 4 | D100: 2 | E100: 8 | G100: 은전동생2:Honey | H100: 고로케(당면) | I100: 3 | J100: 2 | K100: 6
A101: 은전동생1:Honey | B101: 꽈베기 | C101: 35 | D101: 1 | E101: 35 | G101: 은전동생2:Honey | H101: 꽈베기 | I101: 4 | J101: 1 | K101: 4
A102: 은전동생1:Honey | B102: 소보루(튀김) | C102: 2 | D102: 2 | E102: 4 | G102: 은전동생2:Honey | H102: 소보루 | I102: 2 | J102: 1.5 | K102: 3
A103: 은전동생1:Honey | B103: 커피번 | C103: 10 | D103: 1.5 | E103: 15 | G103: 은전동생2:Honey | H103: 소보루(튀김) | I103: 3 | J103: 2 | K103: 6
A104: 은전동생1:Honey | B104: 팥빵(찹쌀) | C104: 4 | D104: 2 | E104: 8 | G104: 은전동생2:Honey | H104: 커피번 | I104: 4 | J104: 1.5 | K104: 6
A105: ** 커피번4개는 치즈없이, 꽈베기 6개는 설탕없이 | E105: =SUM(R[-5]C:R[-1]C) -> 70 | K105: =SUM(R[-5]C:R[-1]C) -> 25
A115: 이야호호(0452 541 004) | B115: 고로케(감자) | C115: 3 | D115: 2 | E115: 6
A116: 이야호호(0452 541 004) | B116: 고로케(당면) | C116: 1 | D116: 2 | E116: 2
A117: 이야호호(0452 541 004) | B117: 꽈베기 | C117: 3 | D117: 1 | E117: 3
A118: 이야호호(0452 541 004) | B118: 소보루 | C118: 3 | D118: 1.5 | E118: 4.5
A119: 이야호호(0452 541 004) | B119: 커피번 | C119: 3 | D119: 1.5 | E119: 4.5
E120: =SUM(R[-5]C:R[-1]C) -> 20
A125: 준탱지땡1:지호네 | B125: 고구마앙금빵 | C125: 1 | D125: 2 | E125: 2 | G125: 준탱지땡2:지민이네 | H125: 고로케(당면) | I125: 2 | J125: 2 | K125: 4
A126: 준탱지땡1:지호네 | B126: 꽈베기 | C126: 6 | D126: 1 | E126: 6 | G126: 준탱지땡2:지민이네 | H126: 꽈베기 | I126: 6 | J126: 1 | K126: 6
A127: 준탱지땡1:지호네 | B127: 소보루(튀김) | C127: 10 | D127: 2 | E127: 20 | G127: 준탱지땡2:지민이네 | H127: 소보루(튀김) | I127: 5 | J127: 2 | K127: 10
A128: 준탱지땡1:지호네 | B128: 커피번 | C128: 2 | D128: 1.5 | E128: 3 | G128: 준탱지땡2:지민이네 | H128: 팥빵(찹쌀) | I128: 5 | J128: 2 | K128: 10
A129: 준탱지땡1:지호네 | B129: 팥빵(찹쌀) | C129: 2 | D129: 2 | E129: 4 | K129: =SUM(R[-4]C:R[-1]C) -> 30
E130: =SUM(R[-5]C:R[-1]C) -> 35
A134: 준탱지땡3:크리스탈 | B134: 꽈베기 | C134: 3 | D134: 1 | E134: 3 | G134: 준탱지땡4:현서네 | H134: 고로케(감자) | I134: 2 | J134: 2 | K134: 4
A135: 준탱지땡3:크리스탈 | B135: 소보루 | C135: 2 | D135: 1.5 | E135: 3 | G135: 준탱지땡4:현서네 | H135: 고로케(당면) | I135: 2 | J135: 2 | K135: 4
A136: 준탱지땡3:크리스탈 | B136: 소보루(튀김) | C136: 5 | D136: 2 | E136: 10 | G136: 준탱지땡4:현서네 | H136: 꽈베기 | I136: 4 | J136: 1 | K136: 4
A137: 준탱지땡3:크리스탈 | B137: 팥빵(찹쌀) | C137: 2 | D137: 2 | E137: 4 | G137: 준탱지땡4:현서네 | H137: 소보루(튀김) | I137: 4 | J137: 2 | K137: 8
E138: =SUM(R[-4]C:R[-1]C) -> 20 | K138: =SUM(R[-4]C:R[-1]C) -> 20
A142: 친절한아줌마(0430 037 620) | B142: 고로케(감자) | C142: 4 | D142: 2 | E142: 8
A143: 친절한아줌마(0430 037 620) | B143: 고로케(당면) | C143: 4 | D143: 2 | E143: 8
A144: 친절한아줌마(0430 037 620) | B144: 꽈베기 | C144: 5 | D144: 1 | E144: 5
A145: 친절한아줌마(0430 037 620) | B145: 소보루 | C145: 15 | D145: 1.5 | E145: 22.5
A146: 친절한아줌마(0430 037 620) | B146: 커피번 | C146: 15 | D146: 1.5 | E146: 22.5
A147: 친절한아줌마(0430 037 620) | B147: 팥빵(찹쌀) | C147: 3 | D147: 2 | E147: 6
E148: =SUM(R[-6]C:R[-1]C) -> 72
A155: 카푸치노1(0430 432 115) | B155: 고로케(감자) | C155: 4 | D155: 2 | E155: 8 | G155: 카푸치노2(0430 432 115) | H155: 고로케(감자) | I155: 2 | J155: 2 | K155: 4
A156: 카푸치노1(0430 432 115) | B156: 꽈베기 | C156: 6 | D156: 1 | E156: 6 | G156: 카푸치노2(0430 432 115) | H156: 고로케(당면) | I156: 2 | J156: 2 | K156: 4
A157: 카푸치노1(0430 432 115) | B157: 소보루 | C157: 2 | D157: 1.5 | E157: 3 | G157: 카푸치노2(0430 432 115) | H157: 꽈베기 | I157: 4 | J157: 1 | K157: 4
A158: 카푸치노1(0430 432 115) | B158: 커피번 | C158: 4 | D158: 1.5 | E158: 6 | G158: 카푸치노2(0430 432 115) | H158: 소보루 | I158: 4 | J158: 1.5 | K158: 6
A159: 카푸치노1(0430 432 115) | B159: 팥빵 | C159: 2 | D159: 1.5 | E159: 3 | G159: 카푸치노2(0430 432 115) | H159: 커피번 | I159: 2 | J159: 1.5 | K159: 3
A160: 카푸치노1(0430 432 115) | B160: 팥빵(찹쌀) | C160: 2 | D160: 2 | E160: 4 | G160: 카푸치노2(0430 432 115) | H160: 팥빵 | I160: 2 | J160: 1.5 | K160: 3
E161: =SUM(R[-6]C:R[-1]C) -> 30 | K161: =SUM(R[-6]C:R[-1]C) -> 24
A174: 0422 853 388 | B174: 고구마앙금빵 | C174: 2 | D174: 2 | E174: 4 | G174: 하선민 | H174: 소보루 | I174: 10 | J174: 1.5 | K174: 15 | L174: 픽업
A175: 0422 853 388 | B175: 꽈베기 | C175: 2 | D175: 1 | E175: 2 | G175: 하선민 | H175: 커피번 | I175: 5 | J175: 1.5 | K175: 7.5 | L175: 픽업
A176: 0422 853 388 | B176: 소보루 | C176: 2 | D176: 1.5 | E176: 3 | G176: 하선민 | H176: 팥빵(찹쌀) | I176: 5 | J176: 2 | K176: 10 | L176: 픽업
A177: 0422 853 388 | B177: 소보루(튀김) | C177: 2 | D177: 2 | E177: 4 | G177: ** 픽업 | K177: =SUM(R[-3]C:R[-1]C) -> 32.5
A178: 0422 853 388 | B178: 팥빵 | C178: 8 | D178: 1.5 | E178: 12
A179: 0422 853 388 | B179: 팥빵(찹쌀) | C179: 5 | D179: 2 | E179: 10
A180: ** 픽업 | E180: =SUM(R[-6]C:R[-1]C) -> 35
A188: Karli | B188: 고구마앙금빵 | C188: 4 | D188: 2 | E188: 8
A189: Karli | B189: 고로케(당면) | C189: 4 | D189: 2 | E189: 8
A190: Karli | B190: 커피번 | C190: 8 | D190: 1.5 | E190: 12
A191: Karli | B191: 팥빵 | C191: 10 | D191: 1.5 | E191: 15
A192: Karli | B192: 팥빵(찹쌀) | C192: 4 | D192: 2 | E192: 8
A193: ** 배달:지난번 못받은 10불 같이 받을것 | E193: =SUM(R[-5]C:R[-1]C) -> 51
A194: ** 8 Stone Ct Viewbank VIC 3084
A201: 김영아 | B201: 고구마앙금빵 | C201: 4 | D201: 2 | E201: 8
A202: 김영아 | B202: 고로케(감자) | C202: 6 | D202: 2 | E202: 12
A203: 김영아 | B203: 꽈베기 | C203: 3 | D203: 1 | E203: 3
A204: 김영아 | B204: 소보루 | C204: 4 | D204: 1.5 | E204: 6
A205: 김영아 | B205: 소보루(튀김) | C205: 6 | D205: 2 | E205: 12
A206: 김영아 | B206: 팥빵 | C206: 6 | D206: 1.5 | E206: 9
A207: ** 배달:밀팍 | E207: =SUM(R[-6]C:R[-1]C) -> 50